PharmGKB ID	Variant	Literature	Genes	Association	Significance	P-Value	# of Cases	# of Controls	Biogeographical Groups	Phenotype Categories	Pediatric	More Details	Drugs
981344274	rs915120	PMCID:PMC3941038	GRK5	Allele C is associated with decreased likelihood of remission at 8 weeks when treated with citalopram or escitalopram in people with Depressive Disorder, Major as compared to allele T.	no	= 1.15E-5	398		European	Efficacy	false	No SNP reached the genome-wide level of significance (P<10-7), although this variant was shown in functional molecular experiments to influence transcription by a reporter gene assay and to alter nuclear protein binding using an electrophoretic mobility shift assay.	citalopram; escitalopram
981502189	rs4680	PMID:20584552	COMT	Genotype GG is not associated with response to fluoxetine in people with Depressive Disorder, Major as compared to genotypes AA + AG.	no	= 0.071	64		Multiple groups, probably White (Spanish mental health center).	Dosage,Efficacy	false	"However, authors note that GG subjects were responders ""slightly more"" than AG or AA.
It was also noted that there was no placebo group in this trial.  The association tested was with response at 4 weeks."	fluoxetine
1447674916	rs2066992	PMID:26556688	IL6	Genotype GT is associated with increased response to duloxetine in people with Depressive Disorder, Major as compared to genotype GG.	no	= 0.047	184		European	Efficacy	false	However, results were not significant after correction for multiple testing.	duloxetine
1184167140	rs7124442	PMID:22965830	BDNF	Genotype CC is not associated with response to antidepressants in people with Depressive Disorder, Major as compared to genotypes CT + TT.	no	= 0.322	324		European	Efficacy	false	This SNP did not affect response to antidepressants. Response was defined as a 50% reduction on the Hamilton Depression Rating Scale (HAMD-21) from baseline to week 6. Naturalistic study, no information was provided on the specific drugs administered.	antidepressants
1449167888	rs10124893	PMID:29407288	TEX10	Allele G is associated with increased response to duloxetine in people with Depressive Disorder, Major as compared to allele A.	yes	< 5E-5	186		European	Efficacy	false	"Variant was suggestively significant, but did not reach genome-wide significance.

Response was defined by >50% decrease in Montgomery-Asberg Depression Rating Scale (MADRS) score at the end of treatment."	duloxetine
1452049661	rs6313	PMID:23245538	HTR2A	Allele A is not associated with diastolic blood pressure when treated with duloxetine in people with Depressive Disorder, Major as compared to allele G.	no		734		European	Toxicity	false	rs6311 and rs6313: not associated with significant differences in changes in sitting diastolic blood pressure	duloxetine
1447674939	rs10242595	PMID:26556688	IL6	Genotype AA is associated with increased response to duloxetine in people with Depressive Disorder, Major as compared to genotypes AG + GG.	no	= 0.038	184		European	Efficacy	false	However, results were not significant after correction for multiple testing.	duloxetine
1184167136	rs6265	PMID:22965830	BDNF	Genotype CC is not associated with response to antidepressants in people with Depressive Disorder, Major as compared to genotypes CT + TT.	no	= 0.8205	324		European	Efficacy	false	This SNP did not affect response to antidepressants. Response was defined as a 50% reduction on the Hamilton Depression Rating Scale (HAMD-21) from baseline to week 6. Naturalistic study, no information was provided on the specific drugs administered. Please note alleles have been complemented to the plus chromosomal strand.	antidepressants
982046974	CYP2D6*1; CYP2D6*2xN	PMID:11802100	CYP2D6	CYP2D6 *1/*2xN is not associated with increased metabolism of citalopram in people with Depressive Disorder, Major as compared to CYP2D6 *1/*1.	no		19		European	Metabolism/PK	false		citalopram
1449167894	rs10989064	PMID:29407288	TEX10	Allele T is associated with increased response to duloxetine in people with Depressive Disorder, Major as compared to allele C.	yes	< 5E-5	186		European	Efficacy	false	"Variant was suggestively significant, but did not reach genome-wide significance.

Response was defined by >50% decrease in Montgomery-Asberg Depression Rating Scale (MADRS) score at the end of treatment."	duloxetine
982046960	CYP2D6*1; CYP2D6*4	PMID:11802100	CYP2D6	CYP2D6 *1/*4 is not associated with decreased metabolism of citalopram in people with Depressive Disorder, Major as compared to CYP2D6 *1/*1.	no		19		European	Metabolism/PK	false		citalopram
981344263	rs11144870	PMCID:PMC3941038	RFK	Allele T is associated with decreased response to citalopram or escitalopram in people with Depressive Disorder, Major as compared to allele C.	no	= 1.04E-6	398		European	Efficacy	false	No SNP reached the genome-wide level of significance (P<10-7), although this variant was shown in functional molecular experiments to influence transcription by a reporter gene assay and to alter nuclear protein binding using an electrophoretic mobility shift assay.	citalopram; escitalopram
1449167900	rs6479008	PMID:29407288	TEX10	Allele C is associated with increased response to duloxetine in people with Depressive Disorder, Major as compared to allele A.	yes	< 5E-5	186		European	Efficacy	false	"Variant was suggestively significant, but did not reach genome-wide significance.

Response was defined by >50% decrease in Montgomery-Asberg Depression Rating Scale (MADRS) score at the end of treatment."	duloxetine
981502205	rs25531	PMID:20584552	SLC6A4	Allele C is not associated with response to fluoxetine in people with Depressive Disorder, Major as compared to allele T.	no		64		Multiple groups, probably White (Spanish mental health center).	Dosage,Efficacy	false	There was no placebo group in this trial.  The association tested was with response at 4 weeks.	fluoxetine
982030345	rs3810651	PMID:23394390	GABRQ	Genotypes AA + AT are associated with increased response to venlafaxine in people with Depressive Disorder, Major as compared to genotype TT.	yes	= 0.001	90	26	East Asian	Efficacy	false	Those with the AA/AT genotype are more likely to be responders. Please note; this is an A/T SNP and due to inconsistencies reported for other SNP alleles in the paper this should be kept in mind.	venlafaxine
1183624207	CYP2D6*1; CYP2D6*4; CYP2D6*5	PMID:8867869	CYP2D6	CYP2D6 *1/*4 + *1/*5 is not associated with differences in nortriptyline concentrations when treated with nortriptyline in people with Depressive Disorder, Major as compared to CYP2D6 *1/*1.	no	> 0.05	21		European	Metabolism/PK	false	one patient was *4/*4; 13 subjects were heterozygous for *3, *4, *5; 7 are *1/*1	nortriptyline
1449168100	rs12502866	PMID:29407288		Allele G is associated with increased response to duloxetine in people with Depressive Disorder, Major as compared to allele A.	yes	< 5E-5	186		European	Efficacy	false	"Variant was suggestively significant, but did not reach genome-wide significance.

Variant was associated with an increased likelihood of the patient entering remission, as defined by a score of 10 or more on the Montgomery-Asberg Depression Rating Scale (MADRS) score at the end of treatment."	duloxetine
1452420123	rs2032582	PMID:36681895	ABCB1	Allele T is not associated with concentrations of desmethylcitalopram or escitalopram in people with Depressive Disorder, Major as compared to allele C.	no	> 0.05	165		Multiple groups	Metabolism/PK	false	There was no significant association between this variant and dose-adjusted serum levels of escitalopram or S-desmethylcitalopram. Please note that alleles have been complemented to the positive strand.	desmethylcitalopram; escitalopram
1449168106	rs12094644	PMID:29407288		Allele T is associated with decreased response to duloxetine in people with Depressive Disorder, Major as compared to allele A.	yes	< 5E-5	186		European	Efficacy	false	"Variant was suggestively significant, but did not reach genome-wide significance.

Variant was associated with an decreased likelihood of the patient entering remission, as defined by a score of 10 or more on the Montgomery-Asberg Depression Rating Scale (MADRS) score at the end of treatment."	duloxetine
982030340	rs1992647	PMID:23394390	GABRA6	Genotype AA is associated with decreased response to Selective serotonin reuptake inhibitors or venlafaxine in people with Depressive Disorder, Major as compared to genotype GG.	no	= 0.003208	204	75	East Asian	Efficacy	false	However this was not statistically significant after permutation correction. Those with the AA genotype are more likely to be non-responders.	Selective serotonin reuptake inhibitors; venlafaxine
1452424220	rs1045642	PMID:36681895	ABCB1	Genotypes AG + GG are not associated with concentrations of aripiprazole in people with Depressive Disorder, Major as compared to genotype AA.	no	= 0.384	90		Multiple groups	Metabolism/PK	false	There was no significant association between this variant and mean aripiprazole/dehydroaripiprazole ratios at either week 10 or 16. Please note that alleles have been complemented to the positive strand.	aripiprazole
1449168112	rs2419128	PMID:29407288		Allele C is associated with decreased response to duloxetine in people with Depressive Disorder, Major as compared to allele T.	yes	< 5E-5	186		European	Efficacy	false	"Variant was suggestively significant, but did not reach genome-wide significance.

Variant was associated with an decreased likelihood of the patient entering remission, as defined by a score of 10 or more on the Montgomery-Asberg Depression Rating Scale (MADRS) score at the end of treatment."	duloxetine
1183620125	rs1045642	PMCID:PMC2268970	ABCB1	Allele G is not associated with differences in remission or tolerance when treated with citalopram in people with Depressive Disorder, Major as compared to allele A.	no		1046		Multiple groups	Efficacy,Toxicity	false		citalopram
1183699996	CYP2C19*1; CYP2C19*2; CYP2C19*3; CYP2C19*17	PMCID:PMC3571021	CYP2C19	CYP2C19 *1/*2 + *1/*3 + *17/*2 + *17/*3 + *2/*2 + *2/*3 + *3/*3 are associated with decreased clearance of escitalopram in people with Depressive Disorder, Major as compared to CYP2C19 *1/*1 + *1/*17 + *17/*17.	yes	< 0.005	128		Multiple groups, 93% White	Metabolism/PK	false		escitalopram
982030363	rs3761555	PMID:23394390	GRIA3	Genotype TT is associated with decreased response to Selective serotonin reuptake inhibitors or venlafaxine in people with Depressive Disorder, Major as compared to genotypes CC + CT.	yes	= 0.017	219		East Asian	Efficacy	false	Regression model looking at interaction between genetic and environemental factors. The TT genotype with nLES high adversity was associated with non-response, compared to the CC/CT genotype and nLES low adversity.  Please note; in the paper this SNP was reported with A and G alleles - here we use T and C to represent these. nLES = life event scale.	Selective serotonin reuptake inhibitors; venlafaxine
1183624218	CYP2D6*1; CYP2D6*4; CYP2D6*5	PMID:8867869	CYP2D6	CYP2D6 *1/*4 + *1/*5 is associated with decreased concentrations of 10-OH-nortriptyline and higher nortriptyline/10-OH-nortriptyline ratio when treated with nortriptyline in people with Depressive Disorder, Major as compared to CYP2D6 *1/*1.	yes	= 0.0038	21		European	Metabolism/PK	false	one patient was *4/*4; 13 subjects were heterozygous for *3, *4, *5 (all alleles were group therefore not only *1/*4+*1/*5 but also *1/*3; 7 are *1/*1	nortriptyline
1449168118	rs4437856	PMID:29407288		Allele A is associated with decreased response to duloxetine in people with Depressive Disorder, Major as compared to allele C.	yes	< 5E-5	186		European	Efficacy	false	"Variant was suggestively significant, but did not reach genome-wide significance.

Variant was associated with an decreased likelihood of the patient entering remission, as defined by a score of 10 or more on the Montgomery-Asberg Depression Rating Scale (MADRS) score at the end of treatment."	duloxetine
1452420100	rs2235040	PMID:36681895	ABCB1	Genotypes CC + CT are not associated with concentrations of desmethylcitalopram or escitalopram in people with Depressive Disorder, Major as compared to genotype TT.	no	> 0.05	178		Multiple groups	Metabolism/PK	false	There was no significant association between this variant and dose-adjusted serum levels of escitalopram or S-desmethylcitalopram. Please note that alleles have been complemented to the positive strand.	desmethylcitalopram; escitalopram
1452420106	rs1128503	PMID:36681895	ABCB1	Genotypes AG + GG are not associated with concentrations of desmethylcitalopram or escitalopram in people with Depressive Disorder, Major as compared to genotype AA.	no	> 0.05	165		Multiple groups	Metabolism/PK	false	There was no significant association between this variant and dose-adjusted serum levels of escitalopram or S-desmethylcitalopram. Please note that alleles have been complemented to the positive strand.	desmethylcitalopram; escitalopram
982030355	rs502434	PMID:23394390	GRIA3	Genotype CC is associated with decreased response to Selective serotonin reuptake inhibitors or venlafaxine in people with Depressive Disorder, Major as compared to genotypes CT + TT.	yes	= 0.02	208		East Asian	Efficacy	false	Regression model looking at interaction between genetic and environemental factors. The CC genotype with CTQ-SF high adversity was associated with non-response, compared to the TT/TC genotype and CTQ-SF low adversity.  Please note; in the paper this SNP was reported with A and G alleles - here we use T and C to represent these. CTQ-SF = childhood trauma questionaire 28-item short form.	Selective serotonin reuptake inhibitors; venlafaxine
1449168125	rs12657120	PMID:29407288	TTC37	Allele G is associated with decreased response to duloxetine in people with Depressive Disorder, Major as compared to allele C.	yes	< 5E-5	186		European	Efficacy	false	"Variant was suggestively significant, but did not reach genome-wide significance.

Variant was associated with an decreased likelihood of the patient entering remission, as defined by a score of 10 or more on the Montgomery-Asberg Depression Rating Scale (MADRS) score at the end of treatment."	duloxetine
1446904991	CYP2D6 poor metabolizers	PMID:9049581	CYP2D6	CYP2D6 poor metabolizer is associated with decreased dose of desipramine in people with Depressive Disorder, Major as compared to CYP2D6 normal metabolizer.	not stated		31		European	Dosage	false	CYP2D6 phenotype was determined with dextromethorphan. Two patients were classified as poor metabolizers (PMs) (MR > 0.3) rest of the patients EMs with 11 rapid (cut-off 0.01) and 18 slow EMs. 100mg/day desipramine for 3 weeks. Plasma desipramine levels were correlated significantly with the dextromethorphan MR (p<0.01). Two PMs had highest plasma concentration of desipramine and required a dose reduction due to side effects. No information about possible co-treatment.	desipramine
1183620143	rs2740574	PMCID:PMC2268970	CYP3A4	Allele T is not associated with differences in remission or tolerance when treated with citalopram in people with Depressive Disorder, Major as compared to allele C.	no		1046		Multiple groups	Efficacy,Toxicity	false		citalopram
1183620136	rs2032582	PMCID:PMC2268970	ABCB1	Allele C is not associated with differences in remission or tolerance when treated with citalopram in people with Depressive Disorder, Major as compared to allele A.	no		1046		Multiple groups	Efficacy,Toxicity	false		citalopram
1452053545	rs25531	PMID:19272758	SLC6A4	Allele C is not associated with response to escitalopram in people with Depressive Disorder, Major as compared to allele T.	no		135		European	Metabolism/PK	false	The rs25531 variant was not associated with significant differences in response (MADRS) in patients receiving escitalopram.	escitalopram
1296599021	rs28364032	PMID:24422887	CRHR1	Genotypes AA + AG is associated with increased response to antidepressants in people with Depressive Disorder, Major as compared to genotype GG.	yes	= 0.0045	273		East Asian	Efficacy	false	"Those who were classified as ""remitters"" had a higher frequency of the AA+AG genotype as compared to ""non-remitters"". Remission was defined as total HAMD-17 score of <= 7 after 8 weeks of treatment. Corrected p-values using permutation testing. Note that significant results were also seen when considering only SSRIs (allelic association p=0.024) or SNRIs (allelic association p=0.010), but these results did not withstand permutation testing."	antidepressants
1452053540	rs25531	PMID:17123473	SLC6A4	Allele C is not associated with response to citalopram in people with Depressive Disorder, Major as compared to allele T.	no		1914		Multiple groups	Efficacy	false	The rs25531 variant was not associated with significant differences in response (QIDS-SR) in patients receiving citalopram.	citalopram
1452426300	rs1045642	PMID:36681895	ABCB1	Genotypes AC + CC are not associated with risk of adverse events when treated with antidepressants in people with Depressive Disorder, Major as compared to genotype AA.	no	= 0.20	938		Multiple groups	Toxicity	false	Please note that alleles have been complemented to the positive strand.	antidepressants
982030375	rs3761554	PMID:23394390	GRIA3	Genotype TT is associated with decreased response to Selective serotonin reuptake inhibitors or venlafaxine in people with Depressive Disorder, Major as compared to genotypes CC + CT.	yes	= 0.014	219		East Asian	Efficacy	false	Regression model looking at interaction between genetic and environemental factors. The TT genotype with nLES high adversity was associated with non-response, compared to the CC/CT genotype and nLES low adversity.  Please note; in the paper this SNP was reported with A and G alleles - here we use T and C to represent these. nLES = life event scale.	Selective serotonin reuptake inhibitors; venlafaxine
1183620131	rs1128503	PMCID:PMC2268970	ABCB1	Allele G is not associated with differences in remission or tolerance when treated with citalopram in people with Depressive Disorder, Major as compared to allele A.	no		1046		Multiple groups	Efficacy,Toxicity	false		citalopram
981848117	rs17135437	PMCID:PMC3410623	COL26A1	Allele T is associated with increased hearing and vision-related side-effects when treated with citalopram in people with Depressive Disorder, Major as compared to allele C.	yes	= 3.27E-8	1762		Multiple groups	Toxicity	false	The T allele is associated with an increased incidence of ringing in the ears and blurred vision. Side effects were rated on the Patient-Rated Inventory of Side Effects (PRISE). Patients either indicated that the side effect was present or it was not. Please note these alleles have been complemented to the plus chromosomal strand.	citalopram
1452424227	rs2032582	PMID:36681895	ABCB1	Allele T is not associated with concentrations of aripiprazole in people with Depressive Disorder, Major as compared to allele C.	no	= 0.065	89		Multiple groups	Metabolism/PK	false	There was no significant association between this variant and mean aripiprazole/dehydroaripiprazole ratios at either week 10 or 16. Please note that alleles have been complemented to the positive strand.	aripiprazole
1452420129	rs2032583	PMID:36681895	ABCB1	Genotype AG is not associated with concentrations of desmethylcitalopram or escitalopram in people with Depressive Disorder, Major as compared to genotypes AA + GG.	no	> 0.05	178		Multiple groups	Metabolism/PK	false	There was no significant association between this variant and dose-adjusted serum levels of escitalopram or S-desmethylcitalopram. Please note that alleles have been complemented to the positive strand.	desmethylcitalopram; escitalopram
1452370980	CYP2D6 poor metabolizer	PMID:38284409	CYP2D6	CYP2D6 poor metabolizer is associated with increased exposure to desvenlafaxine and venlafaxine in people with Depressive Disorder, Major.	yes	< 0.001	213		Multiple groups	Metabolism/PK	false	"""In PMs, higher VEN exposure (RoM = 18.1, 95% CI: 5.1–36.2) and higher active moiety exposure (RoM = 1.9, 95% CI: 1.3–2.6) were considered clinically relevant."" ""active moiety (VEN + O-desmethylvenlafaxine)"""	desvenlafaxine; venlafaxine
1452424234	rs2032582	PMID:36681895	ABCB1	Allele A is not associated with concentrations of aripiprazole in people with Depressive Disorder, Major as compared to allele C.	no	= 0.065	89		Multiple groups	Metabolism/PK	false	There was no significant association between this variant and mean aripiprazole/dehydroaripiprazole ratios at either week 10 or 16. Please note that alleles have been complemented to the positive strand.	aripiprazole
1452053580	SLC6A4 HTTLPR long form (L allele); SLC6A4 HTTLPR short form (S allele)	PMID:17123473	SLC6A4	SLC6A4 HTTLPR long form (L allele) is not associated with response to citalopram in people with Depressive Disorder, Major as compared to SLC6A4 HTTLPR short form (S allele).	no		1914		Multiple groups	Efficacy	false	The rs25531 variant was not associated with significant differences in response (QIDS-SR) in patients receiving citalopram.	citalopram
981848128	rs16965962	PMCID:PMC3410623		Allele A is associated with increased general side-effect burden when treated with citalopram in people with Depressive Disorder, Major as compared to allele C.	yes	= 3.22E-7	1762		Multiple groups	Toxicity	false	General side effect burden included 26 symptom measures across gastrointestinal, heart, skin, central nervous, vision/hearing, genital/urinary, sleep and sexual systems. Please see the paper for more details on factors included in general side effects. Also note alleles have been complemented to the plus chromosomal strand.	citalopram
1452424280	rs2235015	PMID:36681895	ABCB1	Genotype AA is not associated with concentrations of aripiprazole in people with Depressive Disorder, Major as compared to genotype CC.	no	= 0.671	91		Multiple groups	Metabolism/PK	false	There was no significant association between this variant and mean aripiprazole/dehydroaripiprazole ratios at either week 10 or 16. Please note that alleles have been complemented to the positive strand.	aripiprazole
1452426307	rs2032582	PMID:36681895	ABCB1	Allele A is not associated with risk of adverse events when treated with antidepressants in people with Depressive Disorder, Major as compared to allele C.	no	= 0.26	641		Multiple groups	Toxicity	false	Please note that alleles have been complemented to the positive strand.	antidepressants
1450814625	rs17614642	PMID:22947179	FKBP5	Genotype TT is associated with decreased response to bupropion in people with Depressive Disorder, Major as compared to genotype CT.	yes	= 0.027	251		European	Efficacy	false	Patients with the TT genotype showed a greater reduction in HAMD scores as compared to patients with the CT genotype. Please note that alleles have been complemented to the positive strand.	bupropion
1452047440	rs6311	PMID:24533444	HTR2A	Allele T is not associated with likelihood of Sexual Dysfunctions, Psychological when treated with escitalopram, fluoxetine, fluvoxamine or sertraline in women with Depressive Disorder, Major as compared to allele C.	no		95		Multiple groups	Toxicity	false	rs6311: not associated with significant differences in sexual dysfunction in female	escitalopram; fluoxetine; fluvoxamine; sertraline
1450814619	rs363226	PMID:22947179	SLC18A2	Genotype GG is associated with increased response to bupropion in people with Depressive Disorder, Major as compared to genotypes CC + CG.	yes	= 0.018	251		European	Efficacy	false	Patients with the GG genotype showed a greater reduction in HAMD scores as compared to patients with the CG or GG genotypes.	bupropion
1452424305	rs2032583	PMID:36681895	ABCB1	Genotype AG is not associated with concentrations of aripiprazole in people with Depressive Disorder, Major as compared to genotypes AA + GG.	no	= 0.338	91		Multiple groups	Metabolism/PK	false	There was no significant association between this variant and mean aripiprazole/dehydroaripiprazole ratios at either week 10 or 16. Please note that alleles have been complemented to the positive strand.	aripiprazole
1452053606	SLC6A4 HTTLPR long form (L allele); SLC6A4 HTTLPR short form (S allele)	PMCID:PMC3786570	SLC6A4	SLC6A4 HTTLPR long form (L allele) is not associated with response to citalopram in people with Depressive Disorder, Major as compared to SLC6A4 HTTLPR short form (S allele).	no		101		African American/Afro-Caribbean	Efficacy	false	The 5-HTTLPR was not associated with significant differences in response (HAMD) in patients receiving citalopram.	citalopram
1452424312	rs2235040	PMID:36681895	ABCB1	Genotypes CC + CT are not associated with concentrations of aripiprazole in people with Depressive Disorder, Major as compared to genotype TT.	no	= 0.342	79		Multiple groups	Metabolism/PK	false	There was no significant association between this variant and mean aripiprazole/dehydroaripiprazole ratios at either week 10 or 16. Please note that alleles have been complemented to the positive strand.	aripiprazole
1450814610	rs363225	PMID:22947179	SLC18A2	Genotype CC is associated with increased response to bupropion in people with Depressive Disorder, Major as compared to genotypes CT + TT.	yes	= 0.008	251		European	Efficacy	false	Patients with the CC genotype showed a greater reduction in HAMD scores as compared to patients with the CT or TT genotypes.	bupropion
1452426361	rs2032582	PMID:36681895	ABCB1	Allele T is not associated with risk of adverse events when treated with antidepressants in people with Depressive Disorder, Major as compared to allele C.	no	= 0.26	641		Multiple groups	Toxicity	false	Please note that alleles have been complemented to the positive strand.	antidepressants
