PharmGKB ID	Variant	Literature	Genes	Association	Significance	P-Value	# of Cases	# of Controls	Biogeographical Groups	Phenotype Categories	Pediatric	More Details	Drugs
1183848080	rs2734833	PMID:22796099	DRD2	Allele G is associated with early decrease in the percentage of HAMD scores when treated with Selective serotonin reuptake inhibitors in people with Depressive Disorder, Major as compared to allele A.	no		403		East Asian	Efficacy	false	significant in repeated measures ANOVA week 5 (P=0.0516) and week 6 (P=0.0445) but not after the Bonferroni multiple test.	Selective serotonin reuptake inhibitors
1184749213	rs1801253	PMID:18797399	ADRB1	Allele C is not associated with response to citalopram in people with Depressive Disorder, Major as compared to allele G.	no	> 0.05	730		European	Efficacy	false	No significant differences in the number of patients who were classified as nonresponders, responders or remitters were seen between either the genotypes (CC, CG, GG) or the alleles (C, G), in either European American or African American populations. Remitters achieved a Quick Inventory for Depression Scale, Change 16 Item version (QIDS-C16) score of <= 5 at the last treatment visit. Responders achieved at least a 50% reduction in baseline QIDS-C16 score at the last treatment visit. Nonresponders did not achieve even a 40% reduction in baseline QIDS-C16 score.	citalopram
1183620749	CYP2D6*1; CYP2D6*2xN	PMID:16633156	CYP2D6	CYP2D6 *1/*2xN is associated with non-response when treated with paroxetine in people with Depressive Disorder, Major.	not stated		2		Unknown	Metabolism/PK	false	two case studies	paroxetine
1184749202	rs1801252	PMID:18797399	ADRB1	Allele A is not associated with response to citalopram in people with Depressive Disorder, Major as compared to allele G.	no	> 0.05	730		European	Efficacy	false	No significant differences in the number of patients who were classified as nonresponders, responders or remitters were seen between either the genotypes (AA, AG, GG) or the alleles (A, G), in either European American or African American populations. Remitters achieved a Quick Inventory for Depression Scale, Change 16 Item version (QIDS-C16) score of <= 5 at the last treatment visit. Responders achieved at least a 50% reduction in baseline QIDS-C16 score at the last treatment visit. Nonresponders did not achieve even a 40% reduction in baseline QIDS-C16 score.	citalopram
1183616668	CYP2D6*1; CYP2D6*4	PMID:10460069	CYP2D6	CYP2D6 *4/*4 is associated with increased clomipramine and desmethyl clomipramine plasma concentration when treated with clomipramine in people with Depressive Disorder, Major as compared to CYP2D6 *1.	not stated		109		European	Metabolism/PK	false	NOTE: Study use probe drug sparteine to group subjects into poor and extensive metabolizer. Annotated using *4/*4 for poor metabolizer since *4 is the most frequent non-functional allele. Therefore it can be a combination of any two non-functional alleles not necessarily *4/*4. Annotated *1/*1 for extensive metabolizer but it might be a combination of two functional alleles or a combination of one functional allele and one reduced or non-functional allele. no p-value given	clomipramine
1184749196	rs929493	PMID:18797399	SLC18A2	Allele C is not associated with response to citalopram in people with Depressive Disorder, Major as compared to allele T.	no	> 0.05	730		European	Efficacy	false	No significant differences in the number of patients who were classified as nonresponders, responders or remitters were seen between either the genotypes (CC, CT, TT) or the alleles (C, T), in either European American or African American populations. Remitters achieved a Quick Inventory for Depression Scale, Change 16 Item version (QIDS-C16) score of <= 5 at the last treatment visit. Responders achieved at least a 50% reduction in baseline QIDS-C16 score at the last treatment visit. Nonresponders did not achieve even a 40% reduction in baseline QIDS-C16 score.	citalopram
1184136833	SLC6A4 HTTLPR long form (L allele); SLC6A4 HTTLPR short form (S allele)	PMID:19272758	SLC6A4	SLC6A4 HTTLPR short form (S allele) is associated with increased risk of side effects when treated with escitalopram in people with Depressive Disorder, Major as compared to SLC6A4 HTTLPR long form (L allele).	not stated					Toxicity	false	Please note: full text not available. The S (short) allele was associated with increased risk of drug-induced side effects including headache.	escitalopram
1184749190	rs363343	PMID:18797399	SLC18A2	Allele A is not associated with response to citalopram in people with Depressive Disorder, Major as compared to allele C.	no	> 0.05	730		European	Efficacy	false	No significant differences in the number of patients who were classified as nonresponders, responders or remitters were seen between either the genotypes (AA, AC, CC) or the alleles (A, C), in either European American or African American populations. Remitters achieved a Quick Inventory for Depression Scale, Change 16 Item version (QIDS-C16) score of <= 5 at the last treatment visit. Responders achieved at least a 50% reduction in baseline QIDS-C16 score at the last treatment visit. Nonresponders did not achieve even a 40% reduction in baseline QIDS-C16 score.	citalopram
1184136840	SLC6A4 HTTLPR long form (L allele); SLC6A4 HTTLPR short form (S allele)	PMID:19272758	SLC6A4	SLC6A4 HTTLPR short form (S allele) is not associated with response rate or mean change of depressive symptoms when treated with escitalopram in people with Depressive Disorder, Major as compared to SLC6A4 HTTLPR long form (L allele).	not stated		135		Unknown	Efficacy	false	Please note: full text not available.	escitalopram
1184749184	rs363390	PMID:18797399	SLC18A2	Allele C is not associated with response to citalopram in people with Depressive Disorder, Major as compared to allele G.	no	> 0.05	730		European	Efficacy	false	No significant differences in the number of patients who were classified as nonresponders, responders or remitters were seen between either the genotypes (CC, CG, GG) or the alleles (C, G), in either European American or African American populations. Remitters achieved a Quick Inventory for Depression Scale, Change 16 Item version (QIDS-C16) score of <= 5 at the last treatment visit. Responders achieved at least a 50% reduction in baseline QIDS-C16 score at the last treatment visit. Nonresponders did not achieve even a 40% reduction in baseline QIDS-C16 score.	citalopram
1183616659	CYP2D6*1; CYP2D6*2; CYP2D6*4	PMID:15252821	CYP2D6	CYP2D6 *1/*4 is associated with increased risk of side effects when treated with clomipramine in people with Depressive Disorder, Major as compared to CYP2D6 *1/*2.	not stated		45		European	Toxicity	false	Association with percentage of patients with side effects (increased from 30% to 56% in the *1/*4 group compared to *1/*2 group). no p value given; information based on a table; study compared fluoxetine and clomipramine treatment	clomipramine
1183848115	rs1065852	PMCID:PMC4137829	CYP2D6	Allele A is associated with plasma concentration of S-didesmethyl-citalopram when treated with citalopram or escitalopram in people with Depressive Disorder, Major as compared to allele G.	yes	= 2.0E-16	435		European	Other	false	direction of the association was not given, p = 2.0E-16	citalopram; escitalopram
1184468657	CYP2D6*1; CYP2D6*3; CYP2D6*4; CYP2D6*9; CYP2D6*10; CYP2D6*17; CYP2D6*41	PMID:17803873	CYP2D6	CYP2D6 *3/*9 + *4/*17 + *4/*41 + *4/*10 are associated with decreased dose of venlafaxine in people with Depressive Disorder, Major as compared to CYP2D6 *1/*1.	yes	< 0.002	1		Unknown	Dosage	false	Four CYP2D6 intermediate metabolizer (*3/*9, *4/*17, *4/*41, *4/*10) had maintenance dose not greater than 75 mg/day vs most of the EM (79%) had a dose of 150 mg or more/ day (p<0.002).	venlafaxine
1451351720	rs6313	PMID:27324805	HTR2A	Allele A is not associated with Drug Toxicity when treated with citalopram in children with Anxiety Disorders or Depressive Disorder, Major as compared to allele G.	no		87		Near Eastern	Toxicity	true		citalopram
1184513712	rs41271330	PMID:23926243	BMP5	Genotypes AA + AG is associated with increased dose of escitalopram in people with Depressive Disorder, Major as compared to genotype GG.	not stated	= 0.010	116		European	Efficacy	false	"Predictor of need for a higher escitalopram dose after the initial 4 weeks of treatment. Study design:12 weeks treatment. Patients were defined as responders if the decrease in both MADRS and Hamilton Depression Rating Scale total scores was at least 50%, and the score on the Clinical Global Impression improvement scale was 2
or less.  Five clear responders and five clear non-responders for exome sequencing. Based on the results  38 markers were selected for further genotyping in remaining 116 Estonian patients with MDD.  Out of the 38 marker 5 SNPs were selected that could distinguish the responders from the non-responders in the 116 Estonian MDD patients were further
genotyped in the UK-based GENDEP sample set, comprising 394
MDD patients treated with escitalopram."	escitalopram
1452050080	rs7997012	PMID:19095219	HTR2A	Allele A is not associated with response to duloxetine in people with Depressive Disorder, Major as compared to allele G.	no		250		European	Efficacy	false	rs7997012: not associated with significant differences in change in HAMD scores	duloxetine
1452039840	rs6311	PMCID:PMC4938133	HTR2A	Allele T is not associated with response to citalopram, fluoxetine, paroxetine or sertraline in people with Depressive Disorder, Major as compared to allele C.	no		290		East Asian	Efficacy	false	Response/remission measured using HAMD.	citalopram; fluoxetine; paroxetine; sertraline
1183684281	CYP2D6 poor metabolizer	PMID:9049581	CYP2D6	CYP2D6 poor metabolizer are associated with increased risk of Hypotension, Orthostatic and sedation when treated with desipramine in people with Depressive Disorder, Major as compared to CYP2D6 normal metabolizer.	not stated		31		European	Metabolism/PK,Toxicity	false	CYP2D6 phenotype was determined with dextromethorphan. Two patients were classified as poor metabolizers (PMs) (MR > 0.3) rest of the patients EMs with 11 rapid (cut-off 0.01) and 18 slow EMs. 100mg/day desipramine for 3 weeks. Plasma desipramine levels were correlated significantly with the dextromethorphan MR (p<0.01). Two PMs had highest plasma concentration of desipramine and required a dose reduction due to side effects. 3 patients had side effects such as slight confusion with marked sedation (two cases) and orthostatic hypotension (one case). No information about possible co-treatment.	desipramine
1184513697	rs41271330	PMID:23926243	BMP5	Allele A is associated with decreased response to escitalopram in people with Depressive Disorder, Major as compared to allele G.	yes	= 0.001	394		European	Efficacy	false	"12 weeks treatment. Patients were defined as responders if the decrease in both MADRS and Hamilton Depression Rating Scale total scores was at least 50%, and the score on the Clinical Global Impression improvement scale was 2
or less.  Five clear responders and five clear non-responders for exome sequencing. Based on the results  38 markers were selected for further genotyping in remaining 116 Estonian patients with MDD.  Out of the 38 marker 5 SNPs were selected that could distinguish the responders from the non-responders in the 116 Estonian MDD patients were further
genotyped in the UK-based GENDEP sample set, comprising 394
MDD patients treated with escitalopram."	escitalopram
1183848110	rs1074145	PMCID:PMC4137829		Allele A is associated with concentrations of S-citalopram and metabolic ratio of of S-desmethylcitalopram/citalopram when treated with citalopram or escitalopram in people with Depressive Disorder, Major as compared to allele G.	yes	< 0.05	435		European	Other	false	no direction are giving for the association; p = 4.1E-09 for drug concentration and p = 2.0E-16 for metabolic ratio	citalopram; escitalopram
1452039884	rs6313	PMCID:PMC4938133	HTR2A	Allele A is not associated with response to citalopram, fluoxetine, paroxetine or sertraline in people with Depressive Disorder, Major as compared to allele G.	no		290		East Asian	Efficacy	false	Response/remission measured using HAMD.	citalopram; fluoxetine; paroxetine; sertraline
1184513755	rs12054895	PMID:23377640		Allele T is associated with increased improvement over the first 2 weeks when treated with citalopram or escitalopram in people with Depressive Disorder, Major as compared to allele G.	no	= 0.0000000265	1354		European	Efficacy	false	Association was only with early improvement but not with outcome of early partial response (defined as a 25% improvement on the HAM-D (or equivalent rating on the MADRS or the clinician-rated QIDS)) at 2 weeks. Association was found in a meta-analysis of 980 participants from the STAR*D study and 374 (out of 672) participants from the GENDEP study, that were treated with an SSRI (citalopram or escitalopram) but not in a meta-analysis for STAR*D, GENDEP and MARS.	citalopram; escitalopram
981754567	rs962369	PMID:19641488	BDNF	Allele C is associated with increased likelihood of suicidal ideation when treated with escitalopram or nortriptyline in people with Depressive Disorder, Major as compared to allele T.	yes	< 0.05	727		European	Efficacy,Toxicity	false	p was corrected for hypothesis-wide Meff.  Authors point out that a  limitation was of a lack of placebo control group.	escitalopram; nortriptyline
982047439	CYP2D6*1; CYP2D6*1xN	PMID:16319918	CYP2D6	CYP2D6 *1/*1 is associated with increased clearance of paroxetine in children with Depressive Disorder, Major.	not stated		53		Multiple groups	Metabolism/PK	true	Results are taking from figure 3, no values or statistic given in article. In children with either major depressive disorder or obsessive compulsive disorder taking paroxetine 10 mg/day, extensive 'high' CYP2D6 metabolizers showed much higher clearance compared to other CYP2D6 phenotypes; however, at doses of 20 and 30 mg/day this difference in clearance was not seen. Phenotypes for diplotypes were defined as: extensive 'high' metabolizers = activity score of 1.75 or more, extensive 'medium' = 1.5, extensive 'low' = 1-1.25, intermediate metabolizers = 0.5-0.75, poor metabolizers= 0. Individual diplotypes found in the study population were not described. paroxetine was given 10 mg/day for the first 2 weeks of the study, 20 mg/day for the next 2 weeks, and 30 mg/day for the final 2 weeks. CYP2D6 genotyping was conducted for CYP2D6*2, *3, *4, *5, *6, *7, *8, *9, *10, *11, *12, *15, *17, *29, *35, *36, *40, *41[2988G], *41[2988A], *42, and *45/46 alleles and the presence of *1 times 2, *2 times 2, and *10 times 2 gene duplications. Stepwise regression analysis indicated that clearance was highly dependent on paroxetine dose, CYP2D6 activity score, and weight (p<0.0001).	paroxetine
1446905463	CYP2C19*1; CYP2C19*2; CYP2C19*3	PMID:9316174	CYP2C19	CYP2C19 *2/*2 + *2/*3 are not associated with dose of imipramine in people with Depressive Disorder, Major as compared to CYP2C19 *1/*1.	no		10		East Asian	Dosage	false	Patients received imipramine twice daily at a dose determined by the treating physician. Clinical evaluation was done at day 28. Steady date plasma concentration were determined after 2 weeks. Dose between PM (1.24mg/kg) and EM (1.386 mg/kg) did not differ significantly. No difference in improvement (HAM-D score) or side effect risk (UKU score) was found between PM and EM. No co-medication.	imipramine
1184165575	CYP2D6*1; CYP2D6*2xN	PMID:16633156	CYP2D6	CYP2D6 *1/*2xN is associated with undetectable or low paroxetine serum concentrations when treated with paroxetine in people with Depressive Disorder, Major.	not stated		1		Unknown	Metabolism/PK	false	Case study. 46-year-old man who was treated with paroxetine 20 mg/d. Paroxetine serum concentration below the limit of detection for the analytical method (<5 nmol/L). Dose increased to 40, 60, and 75 mg/d within a month. Serum concentrations increased to 14, 35, and 56 nmol/L, respectively.  Lack of clinical effect at any concentrations concentration is below the 2.5th percentile of 1482 paroxetine concentration measurments from routine drug monitoring database.	paroxetine
655386443	rs11042725	PMID:19636336	ADM	Genotype CC is associated with decreased response to paroxetine in people with Depressive Disorder, Major as compared to genotypes AA + AC.	yes	= 0.001	285	181	Unknown	Efficacy	false	not associated for but not to fluoxetine or citalopram	paroxetine
1452039908	rs17289304	PMCID:PMC4938133	HTR2A	Allele T is not associated with response to citalopram, fluoxetine, paroxetine or sertraline in people with Depressive Disorder, Major as compared to allele G.	no		290		East Asian	Efficacy	false	Response/remission measured using HAMD.	citalopram; fluoxetine; paroxetine; sertraline
981754611	rs11195419	PMID:19641488	ADRA2A	Genotypes AA + AC are associated with increased suicidal ideation when treated with nortriptyline in people with Depressive Disorder, Major as compared to genotype CC.	no		727		European	Efficacy,Toxicity	false	This result was not significant after correction for multiple testing.  Authors point out that a  limitation was of a lack of placebo control group.	nortriptyline
1184513760	rs12054895	PMID:23377640		Allele T is not associated with improvement over the first 2 weeks when treated with Selective serotonin reuptake inhibitors in people with Depressive Disorder, Major as compared to allele G.	no	= 2.65E-8	2256		European	Efficacy	false		Selective serotonin reuptake inhibitors
1452050160	rs7997012	PMID:23245538	HTR2A	Allele A is not associated with diastolic blood pressure when treated with duloxetine in people with Depressive Disorder, Major as compared to allele G.	no		734		European	Toxicity	false	not associated with significant differences in changes in sitting diastolic blood pressure	duloxetine
1451407100	rs6265	PMID:31792367	BDNF; BDNF-AS	Allele T is not associated with likelihood of Sexual Dysfunctions, Psychological due to citalopram or sertraline in people with Depressive Disorder, Major as compared to allele C.	no		133		Unknown	Toxicity	false		citalopram; sertraline
1183620621	CYP2D6*1; CYP2D6*3; CYP2D6*4	PMID:14639062	CYP2D6	CYP2D6 *3/*4 is associated with increased paroxetine plasma concentration when treated with paroxetine in people with Depressive Disorder, Major as compared to CYP2D6 *1/*1.	yes	= 0.0001	37		European	Metabolism/PK	false	Note: only the genotype for PM was given; the EM are only referred as extensive metabolizer in the paper without any specification of alleles. The comparison is for all PM together (*3/*4, *4/*4, *4/*5) vs EM.	paroxetine
1183944211	SLC6A4 HTTLPR long form (L allele); SLC6A4 HTTLPR short form (S allele)	PMID:11027924	SLC6A4	SLC6A4 HTTLPR short form (S allele) is associated with increased time to improve (based on mean reductions from baseline in HRSD) when treated with paroxetine in people with Depressive Disorder, Major as compared to SLC6A4 HTTLPR long form (L allele)/HTTLPR long form (L allele).	yes	= 0.0275	34		Unknown	Efficacy	false	S and l alleles were determined using DNA amplification (PCR) and established flanking primers according Edenberg et al. PMID:9800223. Genotypes were classified into ll and s (sl and ss alleles). At the second week of paroxetine treatment, 11 (52%) of the ll group had a 50% reduction in Hamilton score compared to none (n = 30) of the s group ( p < 0.0001).	paroxetine
982028800	rs5443	PMID:23733030	GNB3	Genotypes CC + CT are associated with increased response to antidepressants in people with Depressive Disorder, Major as compared to genotype TT.	yes	= 0.03	635		East Asian	Efficacy	false		antidepressants
1183620613	CYP2D6*1; CYP2D6*3; CYP2D6*4; CYP2D6*5	PMID:14639062	CYP2D6	CYP2D6 *3/*4 + *4/*4 + *4/*5 is associated with increased paroxetine plasma concentration when treated with paroxetine in people with Depressive Disorder, Major as compared to CYP2D6 normal metabolizer.	yes	= 0.00001	37		European	Metabolism/PK	false	Note: only the genotype for PM was given; the EM are only referred as extensive metabolizer in the paper without any specification of alleles. The comparison is for all PM together (*3/*4, *4/*4, *4/*5) vs EM. Blood samples were obtained at the beginning of the treatment for genetic determination and after steady-state concentration was reached (at least 5 weeks) for plasma drug quantification. paroxetine (20 mg/day). Paroxetine plasma concentration in EM (n=30) (20.97 ± 21.17 µg/L) was significantly different from plasma concentration in PM (n=6) (72.50 ± 29.65 µg/L, P = 0.00001).	paroxetine
1450931954	rs5441	PMID:30324302	GNB3	Genotype GG is associated with increased response to sertraline in people with Depressive Disorder, Major as compared to genotypes AA + AG.	yes	= 0.004	100		Near Eastern	Efficacy	false	Patients with the GG genotype were significantly more likely to respond to sertraline than those with the AA or AG genotypes. Response was defined by achieving at least a 50% reduction in baseline HDRS score during six weeks of sertraline treatment. Variant referred to as A-350G in the paper.	sertraline
1184513558	rs57098334	PMID:12208565		Allele (CCCACCCGA)10 is not associated with increased risk of Nausea when treated with fluvoxamine in people with Depressive Disorder, Major as compared to allele (CCCACCCGA)12.	no		54		Unknown	Toxicity	false	PCR products were separated on 3% agarose gel allowing differentiation of the variable number of tandem repeats (STin2.9, 250 bp; STin2.10, 267 bp; and STin2.12, 300 bp).	fluvoxamine
982028807	rs1360780	PMID:23733030	FKBP5	Genotype CC is associated with decreased response to antidepressants in people with Depressive Disorder, Major as compared to genotypes CT + TT.	yes	= 0.02	1405		European	Efficacy	false		antidepressants
1452049949	rs7997012	PMID:26745768	HTR2A	Allele A is not associated with response to escitalopram in people with Depressive Disorder, Major as compared to allele G.	no		166		East Asian	Efficacy	false	rs7997012: not associated with significant differences in remission (non-/remitter HAMD, MADRS or HAMA) or change in HAMD, MADRS or HAMA scores	escitalopram
1184513547	SLC6A4 HTTLPR long form (L allele); SLC6A4 HTTLPR short form (S allele)	PMID:12208565	SLC6A4	SLC6A4 HTTLPR long form (L allele) is not associated with increased risk of Nausea when treated with fluvoxamine in people with Depressive Disorder, Major as compared to SLC6A4 HTTLPR short form (S allele).	no		54		Unknown	Toxicity	false	HTTLPR determination by PCR: long (528 bp) and the short (484 bp) variant.	fluvoxamine
982028827	rs3800373	PMID:23733030	FKBP5	Genotype AA is not associated with response to antidepressants in people with Depressive Disorder, Major as compared to genotypes AC + CC.	no	= 0.35	2049		Multiple groups	Efficacy	false		antidepressants
1183620639	CYP2D6*2; CYP2D6*2xN	PMID:14639062	CYP2D6	CYP2D6 *2/*2xN is associated with undetectable paroxetine plasma concentration when treated with paroxetine in people with Depressive Disorder, Major.	not stated	= 1.0E-5	1		European	Metabolism/PK	false	One UM in study with undetectable plasma concentrations in cohort of 37 patients. Blood samples were obtained at the beginning of the treatment for genetic determination and after steady-state concentration was reached (at least 5 weeks) for plasma drug quantification. paroxetine (20 mg/day).	paroxetine
1184513538	SLC6A4 HTTLPR long form (L allele); SLC6A4 HTTLPR short form (S allele)	PMID:17414739	SLC6A4	SLC6A4 HTTLPR short form (S allele)/HTTLPR long form (L allele) is associated with increased risk of side effects when treated with Selective serotonin reuptake inhibitors in people with Depressive Disorder, Major as compared to SLC6A4 HTTLPR long form (L allele)/HTTLPR long form (L allele).	no		209		European	Toxicity	false	Results are not statistically significant. General adverse events: dermatologic reactions, weight change and fatigue.	Selective serotonin reuptake inhibitors
982028817	rs1360780	PMID:23733030	FKBP5	Genotype CC is not associated with response to antidepressants in people with Depressive Disorder, Major as compared to genotypes CT + TT.	no	= 0.47	2194		Multiple groups	Efficacy	false		antidepressants
1183620631	CYP2D6*1; CYP2D6*4; CYP2D6*5	PMID:14639062	CYP2D6	CYP2D6 *4/*5 is associated with increased paroxetine plasma concentration when treated with paroxetine in people with Depressive Disorder, Major as compared to CYP2D6 *1/*1.	yes	= 0.0001	37		European	Metabolism/PK	false	Note: only the genotype for PM was given; the EM are only referred as extensive metabolizer in the paper without any specification of alleles. The comparison is for all PM together (*3/*4, *4/*4, *4/*5) vs EM.	paroxetine
1450931941	rs45476395	PMID:30324302	GNB3	Allele T is not associated with response to sertraline in people with Depressive Disorder, Major as compared to allele A.	no	= 0.920	100		Near Eastern	Efficacy	false	No significant association between this variant and changes in HDRS score during 6 weeks of sertraline treatment. Variant referred to as A657T in the paper.	sertraline
1447950063	CYP2B6*1; CYP2B6*6; CYP2B6*9	PMID:26830411	CYP2B6	CYP2B6 *6/*9 + *1/*6 + *6/*6 is associated with increased concentrations of sertraline in people with Depressive Disorder, Major as compared to CYP2B6 *1/*1.	yes	= 0.0001	50		Unknown	Metabolism/PK	false	2B6*1/*6 n=13 2B6*6/*6 n=7 2B6*6/*9 n=3 *1/*1=27	sertraline
